{
  "fixtures": [
    {
      "category": "literal",
      "expected": { "outcome": "matched", "value": 42 },
      "id": "EX-LITERAL-001",
      "input": { "facts": {}, "parameters": {} },
      "normativeRefs": ["RL-010-EX-LITERAL-001"],
      "sourceDocument": { "expression": { "literal": 42 } },
      "support": ["schema", "compile", "evaluate"]
    },
    {
      "category": "fact",
      "expected": { "outcome": "matched", "value": 75 },
      "id": "EX-FACT-001",
      "input": { "facts": { "order": { "total": 75 } }, "parameters": {} },
      "normativeRefs": ["RL-010-EX-FACT-001"],
      "sourceDocument": { "expression": { "fact": "order", "path": "/total" } },
      "support": ["schema", "compile", "evaluate"]
    },
    {
      "category": "missing",
      "expected": { "outcome": "indeterminate", "state": "missingFact" },
      "id": "EX-MISSING-FACT-001",
      "input": { "facts": {}, "parameters": {} },
      "normativeRefs": ["RL-010-EX-MISSING-FACT-001"],
      "sourceDocument": { "expression": { "fact": "order" } },
      "support": ["schema", "compile", "evaluate"]
    },
    {
      "category": "missing",
      "expected": { "outcome": "indeterminate", "state": "missingPath" },
      "id": "EX-MISSING-PATH-001",
      "input": { "facts": { "order": {} }, "parameters": {} },
      "normativeRefs": ["RL-010-EX-MISSING-PATH-001"],
      "sourceDocument": {
        "expression": { "fact": "order", "path": "/missing" }
      },
      "support": ["schema", "compile", "evaluate"]
    },
    {
      "category": "null",
      "expected": { "outcome": "matched" },
      "id": "EX-NULL-001",
      "input": { "facts": { "order": { "coupon": null } }, "parameters": {} },
      "normativeRefs": ["RL-010-EX-NULL-001"],
      "sourceDocument": {
        "expression": {
          "eq": [{ "fact": "order", "path": "/coupon" }, { "literal": null }]
        }
      },
      "support": ["schema", "compile", "evaluate"]
    },
    {
      "category": "parameter",
      "expected": { "outcome": "matched", "value": 18 },
      "id": "EX-PARAMETER-001",
      "input": {
        "facts": {},
        "parameters": { "limits": { "minimumAge": 18 } }
      },
      "normativeRefs": ["RL-010-EX-PARAMETER-001"],
      "sourceDocument": {
        "expression": { "parameter": "limits", "path": "/minimumAge" }
      },
      "support": ["schema", "compile", "evaluate"]
    },
    {
      "category": "boolean",
      "expected": { "outcome": "matched" },
      "id": "EX-ALL-001",
      "input": { "facts": { "country": "CA" }, "parameters": {} },
      "normativeRefs": ["RL-010-EX-ALL-001"],
      "sourceDocument": {
        "expression": {
          "all": [{ "eq": [{ "fact": "country" }, { "literal": "CA" }] }]
        }
      },
      "support": ["schema", "compile", "evaluate"]
    },
    {
      "category": "boolean",
      "expected": { "outcome": "matched" },
      "id": "EX-EMPTY-ALL-001",
      "input": { "facts": {}, "parameters": {} },
      "normativeRefs": ["RL-010-EX-EMPTY-ALL-001"],
      "sourceDocument": { "expression": { "all": [] } },
      "support": ["schema", "compile", "evaluate"]
    },
    {
      "category": "boolean",
      "expected": { "outcome": "notMatched" },
      "id": "EX-SHORT-CIRCUIT-ALL-001",
      "input": { "facts": {}, "parameters": {} },
      "normativeRefs": ["RL-010-EX-SHORT-CIRCUIT-ALL-001"],
      "sourceDocument": {
        "expression": {
          "all": [
            { "eq": [{ "literal": 1 }, { "literal": 2 }] },
            { "fact": "missing" }
          ]
        }
      },
      "support": ["schema", "compile", "evaluate"]
    },
    {
      "category": "boolean",
      "expected": { "outcome": "matched" },
      "id": "EX-ANY-001",
      "input": { "facts": {}, "parameters": {} },
      "normativeRefs": ["RL-010-EX-ANY-001"],
      "sourceDocument": {
        "expression": {
          "any": [
            { "eq": [{ "literal": "x" }, { "literal": "y" }] },
            { "eq": [{ "literal": 3 }, { "literal": 3 }] }
          ]
        }
      },
      "support": ["schema", "compile", "evaluate"]
    },
    {
      "category": "boolean",
      "expected": { "outcome": "notMatched" },
      "id": "EX-EMPTY-ANY-001",
      "input": { "facts": {}, "parameters": {} },
      "normativeRefs": ["RL-010-EX-EMPTY-ANY-001"],
      "sourceDocument": { "expression": { "any": [] } },
      "support": ["schema", "compile", "evaluate"]
    },
    {
      "category": "boolean",
      "expected": { "outcome": "matched" },
      "id": "EX-SHORT-CIRCUIT-ANY-001",
      "input": { "facts": {}, "parameters": {} },
      "normativeRefs": ["RL-010-EX-SHORT-CIRCUIT-ANY-001"],
      "sourceDocument": {
        "expression": {
          "any": [
            { "eq": [{ "literal": true }, { "literal": true }] },
            { "fact": "missing" }
          ]
        }
      },
      "support": ["schema", "compile", "evaluate"]
    },
    {
      "category": "boolean",
      "expected": { "outcome": "matched" },
      "id": "EX-NOT-001",
      "input": { "facts": {}, "parameters": {} },
      "normativeRefs": ["RL-010-EX-NOT-001"],
      "sourceDocument": {
        "expression": {
          "not": { "eq": [{ "literal": "a" }, { "literal": "b" }] }
        }
      },
      "support": ["schema", "compile", "evaluate"]
    },
    {
      "category": "comparison",
      "expected": { "outcome": "matched" },
      "id": "EX-EQ-001",
      "input": { "facts": {}, "parameters": {} },
      "normativeRefs": ["RL-010-EX-EQ-001"],
      "sourceDocument": {
        "expression": { "eq": [{ "literal": "gold" }, { "literal": "gold" }] }
      },
      "support": ["schema", "compile", "evaluate"]
    },
    {
      "category": "comparison",
      "expected": { "outcome": "notMatched" },
      "id": "EX-EQ-TYPE-001",
      "input": { "facts": {}, "parameters": {} },
      "normativeRefs": ["RL-010-EX-EQ-TYPE-001"],
      "sourceDocument": {
        "expression": { "eq": [{ "literal": "1" }, { "literal": 1 }] }
      },
      "support": ["schema", "compile", "evaluate"]
    },
    {
      "category": "comparison",
      "expected": { "outcome": "matched" },
      "id": "EX-NUMERIC-001",
      "input": { "facts": { "score": 95 }, "parameters": {} },
      "normativeRefs": ["RL-010-EX-NUMERIC-001"],
      "sourceDocument": {
        "expression": { "gte": [{ "fact": "score" }, { "literal": 90 }] }
      },
      "support": ["schema", "compile", "evaluate"]
    },
    {
      "category": "comparison",
      "expected": { "outcome": "error", "state": "operatorError" },
      "id": "EX-NUMERIC-TYPE-001",
      "input": { "facts": {}, "parameters": {} },
      "normativeRefs": ["RL-010-EX-NUMERIC-TYPE-001"],
      "sourceDocument": {
        "expression": { "lt": [{ "literal": "9" }, { "literal": 10 }] }
      },
      "support": ["schema", "compile", "evaluate"]
    },
    {
      "category": "membership",
      "expected": { "outcome": "matched" },
      "id": "EX-IN-001",
      "input": { "facts": {}, "parameters": {} },
      "normativeRefs": ["RL-010-EX-IN-001"],
      "sourceDocument": {
        "expression": {
          "in": [{ "literal": "beta" }, { "literal": ["alpha", "beta"] }]
        }
      },
      "support": ["schema", "compile", "evaluate"]
    },
    {
      "category": "membership",
      "expected": { "outcome": "error", "state": "operatorError" },
      "id": "EX-IN-TYPE-001",
      "input": { "facts": {}, "parameters": {} },
      "normativeRefs": ["RL-010-EX-IN-TYPE-001"],
      "sourceDocument": {
        "expression": {
          "in": [{ "literal": "beta" }, { "literal": "alpha,beta" }]
        }
      },
      "support": ["schema", "compile", "evaluate"]
    },
    {
      "category": "comparison",
      "expected": { "outcome": "matched" },
      "id": "EX-OBJECT-EQ-001",
      "input": { "facts": {}, "parameters": {} },
      "normativeRefs": ["RL-010-EX-OBJECT-EQ-001"],
      "sourceDocument": {
        "expression": {
          "eq": [
            { "literal": { "a": 1, "b": 2 } },
            { "literal": { "a": 1, "b": 2 } }
          ]
        }
      },
      "support": ["schema", "compile", "evaluate"]
    },
    {
      "category": "error",
      "expected": { "outcome": "error", "state": "operatorError" },
      "id": "EX-OPERATOR-ERROR-001",
      "input": { "facts": {}, "parameters": {} },
      "normativeRefs": ["RL-010-EX-OPERATOR-ERROR-001"],
      "sourceDocument": {
        "expression": { "gt": [{ "literal": {} }, { "literal": 0 }] }
      },
      "support": ["schema", "compile", "evaluate"]
    },
    {
      "category": "error",
      "expected": { "outcome": "error", "state": "resolverError" },
      "id": "EX-RESOLVER-ERROR-001",
      "input": {
        "facts": { "remoteRiskScore": { "$resolverError": "timeout" } },
        "parameters": {}
      },
      "normativeRefs": ["RL-010-EX-RESOLVER-ERROR-001"],
      "sourceDocument": { "expression": { "fact": "remoteRiskScore" } },
      "support": ["schema", "compile", "evaluate"]
    },
    {
      "category": "ordering",
      "expected": {
        "actions": [{ "type": "notify" }, { "type": "audit" }],
        "outcome": "matched"
      },
      "id": "EX-ACTION-ORDER-001",
      "input": { "facts": {}, "parameters": {} },
      "normativeRefs": ["RL-010-EX-ACTION-ORDER-001"],
      "sourceDocument": {
        "ruleSet": {
          "rules": [
            {
              "actions": [{ "type": "notify" }, { "type": "audit" }],
              "id": "approve",
              "when": { "literal": true }
            }
          ]
        }
      },
      "support": ["schema", "compile", "evaluate"]
    },
    {
      "category": "ordering",
      "expected": { "outcome": "matched", "results": ["first", "second"] },
      "id": "EX-RULE-ORDER-001",
      "input": { "facts": {}, "parameters": {} },
      "normativeRefs": ["RL-010-EX-RULE-ORDER-001"],
      "sourceDocument": {
        "ruleSet": {
          "rules": [